{
  "schema_version": "1.0",
  "id": "demo_pilot_2025",
  "label": "Brújula Laboral MX · piloto ilustrativo",
  "mode": "illustrative",
  "description": "Fixture sintético local para validar el contrato; no es una estimación de México.",
  "sources": [{"id":"demo_fixture_source","name":"Fixture local sintético","url":null,"terms_url":null,"license":"Internal test fixture","authority":null,"access_status":"local_only","approved":true,"checked_at":null,"population":"Synthetic illustration","coverage":"MX nacional y Jalisco ilustrativo","periodicity":"quarterly","methodology":"No microdata; values are illustrative","notes":"Nunca atribuir sus cifras a una fuente real."}],
  "dimensions": {
    "fields": [
      {"id":"demo_field_derecho","label":"Derecho","description":"Campo de estudio ilustrativo."},
      {"id":"demo_field_comunicacion_periodismo","label":"Comunicación y periodismo","description":"Campo de estudio ilustrativo."},
      {"id":"demo_field_ciencias_politicas","label":"Ciencias políticas","description":"Campo de estudio ilustrativo."}
    ],
    "occupations": [{"id":"demo_occupation_legal_professionals","label":"Profesionales del derecho","description":"Ocupación editorial, separada del campo."}],
    "industries": [{"id":"demo_industry_services","label":"Servicios profesionales","description":"Industria editorial, separada del campo."}],
    "geographies": [{"id":"demo_mx","label":"México (nacional)"},{"id":"demo_jalisco","label":"Jalisco (ilustrativo)"}],
    "periods": [{"id":"demo_2025_q2","label":"2025 Q2","start":"2025-04-01","end":"2025-06-30"},{"id":"demo_2025_q3","label":"2025 Q3","start":"2025-07-01","end":"2025-09-30"},{"id":"demo_2025_q4","label":"2025 Q4","start":"2025-10-01","end":"2025-12-31"}],
    "bridges": [{"id":"demo_bridge_field_occupation","from_type":"field_of_study","from_id":"demo_field_derecho","to_type":"occupation","to_id":"demo_occupation_legal_professionals","method":"Editorial hypothesis; requires review","confidence":null,"status":"REVIEW","evidence_refs":["demo_evidence_fixture"]}]
  },
  "metrics": [
    {"id":"mean_monthly_income","label":"Ingreso mensual medio","unit":"MXN/month","description":"Media mensual nominal ilustrativa entre personas empleadas con ingreso positivo.","price_basis":"nominal"},
    {"id":"employed_people","label":"Personas ocupadas","unit":"people","description":"Total ponderado ilustrativo de personas ocupadas.","price_basis":"not_applicable"},
    {"id":"female_share","label":"Proporción de mujeres","unit":"percent","description":"Porcentaje ilustrativo de mujeres bajo la definición registrada.","price_basis":"not_applicable"}
  ],
  "evidence": [{"id":"demo_evidence_fixture","source_id":"demo_fixture_source","label":"Fixture local","url":null,"kind":"synthetic_fixture","note":"Evidencia sintética; no representa una fuente oficial."}],
  "observations": [
    {"id":"demo_derecho_mx_q2_income","concept_type":"field_of_study","concept_id":"demo_field_derecho","geography_id":"demo_mx","period_id":"demo_2025_q2","metric_id":"mean_monthly_income","value":18500,"source_id":"demo_fixture_source","population":"Employed people with positive reported monetary income","methodology_id":"illustrative_formula_v1","unit":"MXN/month","price_basis":"nominal","sample_size":120,"coefficient_variation":null,"status":"REVIEW","precision_note":"Synthetic precision is illustrative.","evidence_refs":["demo_evidence_fixture"],"synthetic":true},
    {"id":"demo_derecho_mx_q2_people","concept_type":"field_of_study","concept_id":"demo_field_derecho","geography_id":"demo_mx","period_id":"demo_2025_q2","metric_id":"employed_people","value":12000,"source_id":"demo_fixture_source","population":"Employed people","methodology_id":"illustrative_formula_v1","unit":"people","price_basis":"not_applicable","sample_size":120,"coefficient_variation":null,"status":"REVIEW","precision_note":"Synthetic precision is illustrative.","evidence_refs":["demo_evidence_fixture"],"synthetic":true},
    {"id":"demo_derecho_mx_q2_female","concept_type":"field_of_study","concept_id":"demo_field_derecho","geography_id":"demo_mx","period_id":"demo_2025_q2","metric_id":"female_share","value":null,"source_id":"demo_fixture_source","population":"Employed people under recorded sex definition","methodology_id":"illustrative_formula_v1","unit":"percent","price_basis":"not_applicable","sample_size":120,"coefficient_variation":null,"status":"UNKNOWN","precision_note":"Synthetic fixture intentionally omits this value.","evidence_refs":["demo_evidence_fixture"],"synthetic":true},
    {"id":"demo_com_mx_q3_income","concept_type":"field_of_study","concept_id":"demo_field_comunicacion_periodismo","geography_id":"demo_mx","period_id":"demo_2025_q3","metric_id":"mean_monthly_income","value":14200,"source_id":"demo_fixture_source","population":"Employed people with positive reported monetary income","methodology_id":"illustrative_formula_v1","unit":"MXN/month","price_basis":"nominal","sample_size":95,"coefficient_variation":null,"status":"REVIEW","precision_note":"Synthetic precision is illustrative.","evidence_refs":["demo_evidence_fixture"],"synthetic":true},
    {"id":"demo_com_mx_q3_people","concept_type":"field_of_study","concept_id":"demo_field_comunicacion_periodismo","geography_id":"demo_mx","period_id":"demo_2025_q3","metric_id":"employed_people","value":9000,"source_id":"demo_fixture_source","population":"Employed people","methodology_id":"illustrative_formula_v1","unit":"people","price_basis":"not_applicable","sample_size":95,"coefficient_variation":null,"status":"REVIEW","precision_note":"Synthetic precision is illustrative.","evidence_refs":["demo_evidence_fixture"],"synthetic":true},
    {"id":"demo_com_mx_q3_female","concept_type":"field_of_study","concept_id":"demo_field_comunicacion_periodismo","geography_id":"demo_mx","period_id":"demo_2025_q3","metric_id":"female_share","value":61.0,"source_id":"demo_fixture_source","population":"Employed people under recorded sex definition","methodology_id":"illustrative_formula_v1","unit":"percent","price_basis":"not_applicable","sample_size":95,"coefficient_variation":null,"status":"REVIEW","precision_note":"Synthetic precision is illustrative.","evidence_refs":["demo_evidence_fixture"],"synthetic":true},
    {"id":"demo_pol_jal_q4_income","concept_type":"field_of_study","concept_id":"demo_field_ciencias_politicas","geography_id":"demo_jalisco","period_id":"demo_2025_q4","metric_id":"mean_monthly_income","value":null,"source_id":"demo_fixture_source","population":"Employed people with positive reported monetary income","methodology_id":"illustrative_formula_v1","unit":"MXN/month","price_basis":"nominal","sample_size":null,"coefficient_variation":null,"status":"UNKNOWN","precision_note":"No illustrative value supplied.","evidence_refs":["demo_evidence_fixture"],"synthetic":true},
    {"id":"demo_pol_jal_q4_people","concept_type":"field_of_study","concept_id":"demo_field_ciencias_politicas","geography_id":"demo_jalisco","period_id":"demo_2025_q4","metric_id":"employed_people","value":3400,"source_id":"demo_fixture_source","population":"Employed people","methodology_id":"illustrative_formula_v1","unit":"people","price_basis":"not_applicable","sample_size":40,"coefficient_variation":null,"status":"REVIEW","precision_note":"Synthetic precision is illustrative.","evidence_refs":["demo_evidence_fixture"],"synthetic":true},
    {"id":"demo_pol_jal_q4_female","concept_type":"field_of_study","concept_id":"demo_field_ciencias_politicas","geography_id":"demo_jalisco","period_id":"demo_2025_q4","metric_id":"female_share","value":54.0,"source_id":"demo_fixture_source","population":"Employed people under recorded sex definition","methodology_id":"illustrative_formula_v1","unit":"percent","price_basis":"not_applicable","sample_size":40,"coefficient_variation":null,"status":"REVIEW","precision_note":"Synthetic precision is illustrative.","evidence_refs":["demo_evidence_fixture"],"synthetic":true}
  ]
}
